{
  "message_type": "event",
  "message_id": "b2d93358-9fa4-4d0a-9c93-5df4ac3bf3c7",
  "schema": "ods.artifact.published",
  "schema_version": "1.0",
  "producer": "A1",
  "published_at": "2026-10-20T12:00:00.000Z",
  "payload": {
    "artifact_id": "defect-taxonomy-a1",
    "artifact_version": "defects-a1-1.0.0",
    "kind": "DEFECT_TAXONOMY",
    "owner": "A1",
    "uri": "registry://b5/a1/defect-taxonomy/defects-a1-1.0.0",
    "hash_sha256": "324476cf7bbef29de8583807c1eb7b4a3709ef269c2db317a670501da4f7440a",
    "valid_from": "2026-10-20T12:00:00.000Z",
    "schema_version": "1.0"
  }
}
